MCQ,Choices,Correct
Who coined the term 'machine learning' in 1959?,a: Donald Hebb | b: Tom M. Mitchell | c: Arthur Samuel | d: Walter Pitts,c
What was the earliest machine learning model introduced by Arthur Samuel in the 1950s?,a: Program for calculating winning chance in chess | b: Program for calculating winning chance in checkers | c: Program for calculating winning chance in tic-tac-toe | d: Program for calculating winning chance in poker,b
What was the purpose of the 'learning machine' called Cybertron developed by Raytheon Company in the early 1960s?,"a: Analyze weather patterns | b: Analyze sonar signals, electrocardiograms, and speech patterns | c: Analyze stock market trends | d: Analyze traffic patterns",b
"According to Tom M. Mitchell, what is the definition of machine learning algorithms?",a: Learning from experience with respect to some class of tasks | b: Learning from textbooks with respect to some class of tasks | c: Learning from lectures with respect to some class of tasks | d: Learning from experiments with respect to some class of tasks,a
What are the two objectives of modern-day machine learning?,a: To predict the past and classify data | b: To classify data and make predictions for future outcomes | c: To predict the future and classify data | d: To classify data and make predictions for past outcomes,b
